{
  "dataset_id": "tr_std_01",
  "split": "train",
  "case_name": "singlezone_commercial_hydronic",
  "weather_class": "standard",
  "control_interval_s": 900,
  "horizon_s": 900,
  "records": [
    {
      "time_s": 0,
      "T_zone_degC": 19.920369505662904,
      "T_outdoor_degC": 6.987695312500023,
      "H_global_Wm2": 0.0,
      "u_heating": 22.453343540370515,
      "power_W": 1060.962578883462,
      "energy_Wh_step": 265.2406447208655
    },
    {
      "time_s": 900,
      "T_zone_degC": 20.167545504724956,
      "T_outdoor_degC": 6.9765625,
      "H_global_Wm2": 0.0,
      "u_heating": 23.926735018998734,
      "power_W": 1102.533735502283,
      "energy_Wh_step": 275.63343387557074
    },
    {
      "time_s": 1800,
      "T_zone_degC": 20.443459656793095,
      "T_outdoor_degC": 6.9677734375,
      "H_global_Wm2": 0.0,
      "u_heating": 19.77816620167066,
      "power_W": 1086.8339121610818,
      "energy_Wh_step": 271.70847804027045
    },
    {
      "time_s": 2700,
      "T_zone_degC": 20.649521813528054,
      "T_outdoor_degC": 6.962499999999977,
      "H_global_Wm2": 0.0,
      "u_heating": 23.54505496937563,
      "power_W": 1099.000187693903,
      "energy_Wh_step": 274.75004692347574
    },
    {
      "time_s": 3600,
      "T_zone_degC": 20.79696875664837,
      "T_outdoor_degC": 6.9619140625,
      "H_global_Wm2": 0.0,
      "u_heating": 20.542570326796685,
      "power_W": 1096.8800041272325,
      "energy_Wh_step": 274.2200010318081
    },
    {
      "time_s": 4500,
      "T_zone_degC": 20.90579163003804,
      "T_outdoor_degC": 6.967187500000023,
      "H_global_Wm2": 0.0,
      "u_heating": 22.07839747413889,
      "power_W": 1098.6769819674187,
      "energy_Wh_step": 274.66924549185467
    },
    {
      "time_s": 5400,
      "T_zone_degC": 20.990683833694106,
      "T_outdoor_degC": 6.9794921875,
      "H_global_Wm2": 0.0,
      "u_heating": 22.96684590342864,
      "power_W": 1098.6624399786783,
      "energy_Wh_step": 274.6656099946696
    },
    {
      "time_s": 6300,
      "T_zone_degC": 21.060250482071638,
      "T_outdoor_degC": 7.0,
      "H_global_Wm2": 0.0,
      "u_heating": 22.68394023931172,
      "power_W": 1098.655966562707,
      "energy_Wh_step": 274.6639916406767
    },
    {
      "time_s": 7200,
      "T_zone_degC": 21.117935771247232,
      "T_outdoor_degC": 7.024999999999977,
      "H_global_Wm2": 0.0,
      "u_heating": 19.585789220049637,
      "power_W": 1089.235425963323,
      "energy_Wh_step": 272.30885649083075
    },
    {
      "time_s": 8100,
      "T_zone_degC": 21.161995088612855,
      "T_outdoor_degC": 7.050000000000011,
      "H_global_Wm2": 0.0,
      "u_heating": 19.019051844063927,
      "power_W": 1064.7254995315557,
      "energy_Wh_step": 266.1813748828889
    },
    {
      "time_s": 9000,
      "T_zone_degC": 21.203456738038255,
      "T_outdoor_degC": 7.074999999999989,
      "H_global_Wm2": 0.0,
      "u_heating": 23.79374272671125,
      "power_W": 1097.6314373214154,
      "energy_Wh_step": 274.40785933035386
    },
    {
      "time_s": 9900,
      "T_zone_degC": 21.24622863104804,
      "T_outdoor_degC": 7.100000000000023,
      "H_global_Wm2": 0.0,
      "u_heating": 19.85851505242447,
      "power_W": 1082.871178814913,
      "energy_Wh_step": 270.71779470372826
    },
    {
      "time_s": 10800,
      "T_zone_degC": 21.285737206836416,
      "T_outdoor_degC": 7.122672193877577,
      "H_global_Wm2": 0.0,
      "u_heating": 22.062840203023892,
      "power_W": 1092.784981427792,
      "energy_Wh_step": 273.196245356948
    },
    {
      "time_s": 11700,
      "T_zone_degC": 21.326770344166277,
      "T_outdoor_degC": 7.14379251700683,
      "H_global_Wm2": 0.0,
      "u_heating": 23.76016770448319,
      "power_W": 1098.6465241721387,
      "energy_Wh_step": 274.6616310430347
    },
    {
      "time_s": 12600,
      "T_zone_degC": 21.366464970625543,
      "T_outdoor_degC": 7.168016581632628,
      "H_global_Wm2": 0.0,
      "u_heating": 23.067887141810644,
      "power_W": 1098.6460129962045,
      "energy_Wh_step": 274.6615032490511
    },
    {
      "time_s": 13500,
      "T_zone_degC": 21.401656821676568,
      "T_outdoor_degC": 7.199999999999989,
      "H_global_Wm2": 0.0,
      "u_heating": 19.936000118668975,
      "power_W": 1089.6755889928897,
      "energy_Wh_step": 272.41889724822244
    },
    {
      "time_s": 14400,
      "T_zone_degC": 21.429608400713732,
      "T_outdoor_degC": 7.242920918367361,
      "H_global_Wm2": 0.0,
      "u_heating": 19.847041305598523,
      "power_W": 1075.6405125860056,
      "energy_Wh_step": 268.9101281465014
    },
    {
      "time_s": 15300,
      "T_zone_degC": 21.456504944756034,
      "T_outdoor_degC": 7.29370748299317,
      "H_global_Wm2": 0.0,
      "u_heating": 22.982357357791784,
      "power_W": 1094.3868413712394,
      "energy_Wh_step": 273.59671034280984
    },
    {
      "time_s": 16200,
      "T_zone_degC": 21.480077915641743,
      "T_outdoor_degC": 7.347640306122457,
      "H_global_Wm2": 0.0,
      "u_heating": 19.060429354229907,
      "power_W": 1058.3274166169663,
      "energy_Wh_step": 264.58185415424157
    },
    {
      "time_s": 17100,
      "T_zone_degC": 21.49720756535453,
      "T_outdoor_degC": 7.399999999999977,
      "H_global_Wm2": 0.0,
      "u_heating": 21.800558150955325,
      "power_W": 1075.723515396883,
      "energy_Wh_step": 268.93087884922073
    },
    {
      "time_s": 18000,
      "T_zone_degC": 21.50615708561594,
      "T_outdoor_degC": 7.449999999999989,
      "H_global_Wm2": 0.0,
      "u_heating": 19.74746121463171,
      "power_W": 1023.6961845717753,
      "energy_Wh_step": 255.92404614294384
    },
    {
      "time_s": 18900,
      "T_zone_degC": 21.510242977527923,
      "T_outdoor_degC": 7.5,
      "H_global_Wm2": 0.0,
      "u_heating": 22.245700993797538,
      "power_W": 1062.814636987831,
      "energy_Wh_step": 265.7036592469577
    },
    {
      "time_s": 19800,
      "T_zone_degC": 21.533594270457172,
      "T_outdoor_degC": 7.550000000000011,
      "H_global_Wm2": 0.0,
      "u_heating": 23.37685994759647,
      "power_W": 1087.6867843940784,
      "energy_Wh_step": 271.9216960985196
    },
    {
      "time_s": 20700,
      "T_zone_degC": 21.562006650337082,
      "T_outdoor_degC": 7.600000000000023,
      "H_global_Wm2": 0.0,
      "u_heating": 20.753062573460724,
      "power_W": 1072.077521577392,
      "energy_Wh_step": 268.019380394348
    },
    {
      "time_s": 21600,
      "T_zone_degC": 21.585328443753667,
      "T_outdoor_degC": 7.649999999999977,
      "H_global_Wm2": 0.0,
      "u_heating": 21.579141239091918,
      "power_W": 1075.2050471091648,
      "energy_Wh_step": 268.8012617772912
    },
    {
      "time_s": 22500,
      "T_zone_degC": 21.610970913512006,
      "T_outdoor_degC": 7.699999999999989,
      "H_global_Wm2": 0.0,
      "u_heating": 23.28804649132863,
      "power_W": 1092.8484967164493,
      "energy_Wh_step": 273.2121241791123
    },
    {
      "time_s": 23400,
      "T_zone_degC": 21.638982310819586,
      "T_outdoor_degC": 7.75,
      "H_global_Wm2": 0.0,
      "u_heating": 22.174517637408776,
      "power_W": 1093.891638477892,
      "energy_Wh_step": 273.472909619473
    },
    {
      "time_s": 24300,
      "T_zone_degC": 21.66627826828028,
      "T_outdoor_degC": 7.800000000000011,
      "H_global_Wm2": 0.0,
      "u_heating": 22.98391617248212,
      "power_W": 1098.6428581556906,
      "energy_Wh_step": 274.66071453892266
    },
    {
      "time_s": 25200,
      "T_zone_degC": 21.691670183520955,
      "T_outdoor_degC": 7.836718749999989,
      "H_global_Wm2": 0.0,
      "u_heating": 23.595394883235418,
      "power_W": 1098.6427301778722,
      "energy_Wh_step": 274.66068254446805
    },
    {
      "time_s": 26100,
      "T_zone_degC": 21.712972476972936,
      "T_outdoor_degC": 7.856249999999989,
      "H_global_Wm2": 0.0,
      "u_heating": 20.37357895120029,
      "power_W": 1090.5961175043424,
      "energy_Wh_step": 272.6490293760856
    },
    {
      "time_s": 27000,
      "T_zone_degC": 21.73114787869224,
      "T_outdoor_degC": 7.872656249999977,
      "H_global_Wm2": 0.0,
      "u_heating": 21.82939327112361,
      "power_W": 1093.5274401328506,
      "energy_Wh_step": 273.38186003321266
    },
    {
      "time_s": 27900,
      "T_zone_degC": 21.74755476473058,
      "T_outdoor_degC": 7.899999999999977,
      "H_global_Wm2": 0.0,
      "u_heating": 20.992768204088488,
      "power_W": 1087.5616423632725,
      "energy_Wh_step": 271.89041059081814
    },
    {
      "time_s": 28800,
      "T_zone_degC": 21.753679580324274,
      "T_outdoor_degC": 7.940625000000011,
      "H_global_Wm2": 0.0,
      "u_heating": 19.016260327149112,
      "power_W": 1034.8759137819939,
      "energy_Wh_step": 258.71897844549846
    },
    {
      "time_s": 29700,
      "T_zone_degC": 21.71491200334765,
      "T_outdoor_degC": 7.987500000000011,
      "H_global_Wm2": 0.0,
      "u_heating": 19.40092556456203,
      "power_W": 930.9507386157832,
      "energy_Wh_step": 232.7376846539458
    },
    {
      "time_s": 30600,
      "T_zone_degC": 21.623180666687006,
      "T_outdoor_degC": 8.040624999999977,
      "H_global_Wm2": 0.0,
      "u_heating": 21.58640840098387,
      "power_W": 965.2028862722682,
      "energy_Wh_step": 241.30072156806705
    },
    {
      "time_s": 31500,
      "T_zone_degC": 21.540153947963574,
      "T_outdoor_degC": 8.100000000000023,
      "H_global_Wm2": 0.0,
      "u_heating": 21.397582872037155,
      "power_W": 953.4221698799105,
      "energy_Wh_step": 238.35554246997762
    },
    {
      "time_s": 32400,
      "T_zone_degC": 21.45078242580098,
      "T_outdoor_degC": 8.168749999999989,
      "H_global_Wm2": 0.0,
      "u_heating": 21.181702021705785,
      "power_W": 932.806605863004,
      "energy_Wh_step": 233.201651465751
    },
    {
      "time_s": 33300,
      "T_zone_degC": 21.360386959906577,